[
  {
    "country": "AU",
    "identifierType": "tax_id_company",
    "identifierName": "Australian Company Number (ACN)",
    "validationLevel": "checksum",
    "authority": "Australian Securities and Investments Commission",
    "sourceUrl": "https://asic.gov.au/for-business/registering-a-company/steps-to-register-a-company/australian-company-numbers/",
    "sourceType": "government_registry",
    "accessedAt": "2026-06-15",
    "lastReviewedAt": "2026-06-15",
    "provenanceStatus": "corroborated",
    "limitations": [
      "Archive the official check-digit calculation.",
      "The 2026-06-15 provenance audit did not locate a public primary document containing the full algorithm; the rule remains cross-runtime tested and must not be described as primary-source verified."
    ],
    "jurisdictionType": "state"
  },
  {
    "country": "BR",
    "identifierType": "tax_id_company",
    "identifierName": "Cadastro Nacional da Pessoa Juridica (CNPJ)",
    "validationLevel": "checksum",
    "authority": "Receita Federal do Brasil",
    "sourceUrl": "https://www.gov.br/receitafederal/pt-br/assuntos/cadastros/cnpj",
    "sourceType": "tax_authority",
    "accessedAt": "2026-06-15",
    "lastReviewedAt": "2026-06-15",
    "provenanceStatus": "corroborated",
    "limitations": [
      "Numeric CNPJ only; re-review before the alphanumeric transition.",
      "The 2026-06-15 provenance audit did not locate a public primary document containing the full algorithm; the rule remains cross-runtime tested and must not be described as primary-source verified."
    ],
    "jurisdictionType": "state"
  },
  {
    "country": "CN",
    "identifierType": "tax_id_company",
    "identifierName": "Unified Social Credit Code",
    "validationLevel": "checksum",
    "authority": "State Administration for Market Regulation",
    "sourceUrl": "https://www.samr.gov.cn/",
    "sourceType": "government_registry",
    "accessedAt": "2026-06-15",
    "lastReviewedAt": "2026-06-15",
    "provenanceStatus": "corroborated",
    "limitations": [
      "Archive the official GB 32100 coding specification.",
      "The 2026-06-15 provenance audit did not locate a public primary document containing the full algorithm; the rule remains cross-runtime tested and must not be described as primary-source verified."
    ],
    "jurisdictionType": "state"
  },
  {
    "country": "FR",
    "identifierType": "tax_id_company",
    "identifierName": "SIREN",
    "validationLevel": "format",
    "authority": "Institut national de la statistique et des etudes economiques",
    "sourceUrl": "https://www.insee.fr/fr/metadonnees/definition/c2047",
    "sourceType": "government_registry",
    "accessedAt": "2026-06-15",
    "lastReviewedAt": "2026-06-15",
    "provenanceStatus": "verified",
    "limitations": [
      "The cited definition identifies a control digit but does not publish its calculation."
    ],
    "jurisdictionType": "state"
  },
  {
    "country": "IN",
    "identifierType": "tax_id_company",
    "identifierName": "Goods and Services Tax Identification Number (GSTIN)",
    "validationLevel": "checksum",
    "authority": "Goods and Services Tax Network",
    "sourceUrl": "https://www.gst.gov.in/",
    "sourceType": "government_portal",
    "accessedAt": "2026-06-15",
    "lastReviewedAt": "2026-06-15",
    "provenanceStatus": "corroborated",
    "limitations": [
      "Archive the official base-36 checksum specification and examples.",
      "The 2026-06-15 provenance audit did not locate a public primary document containing the full algorithm; the rule remains cross-runtime tested and must not be described as primary-source verified."
    ],
    "jurisdictionType": "state"
  },
  {
    "country": "JP",
    "identifierType": "tax_id_company",
    "identifierName": "Corporate Number",
    "validationLevel": "checksum",
    "authority": "Japan Ministry of Finance via e-Gov",
    "sourceUrl": "https://elaws.e-gov.go.jp/document?lawid=426M60000040070",
    "sourceType": "legislation",
    "accessedAt": "2026-06-15",
    "lastReviewedAt": "2026-06-15",
    "provenanceStatus": "verified",
    "limitations": [
      "Article 2 of Ministry of Finance Ordinance No. 70 defines the check-digit formula; offline validation does not confirm that an entity is active."
    ],
    "jurisdictionType": "state"
  },
  {
    "country": "KR",
    "identifierType": "tax_id_company",
    "identifierName": "Business Registration Number",
    "validationLevel": "checksum",
    "authority": "National Tax Service of Korea",
    "sourceUrl": "https://www.nts.go.kr/english/main.do",
    "sourceType": "tax_authority",
    "accessedAt": "2026-06-15",
    "lastReviewedAt": "2026-06-15",
    "provenanceStatus": "corroborated",
    "limitations": [
      "Archive the primary weighted check-digit specification.",
      "The 2026-06-15 provenance audit did not locate a public primary document containing the full algorithm; the rule remains cross-runtime tested and must not be described as primary-source verified."
    ],
    "jurisdictionType": "state"
  },
  {
    "country": "NO",
    "identifierType": "tax_id_company",
    "identifierName": "Organisasjonsnummer",
    "validationLevel": "checksum",
    "authority": "Bronnoysund Register Centre",
    "sourceUrl": "https://www.brreg.no/en/about-us-2/our-registers/about-the-central-coordinating-register-for-legal-entities-ccr/",
    "sourceType": "government_registry",
    "accessedAt": "2026-06-15",
    "lastReviewedAt": "2026-06-15",
    "provenanceStatus": "corroborated",
    "limitations": [
      "Archive the primary modulus-11 technical specification.",
      "The 2026-06-15 provenance audit did not locate a public primary document containing the full algorithm; the rule remains cross-runtime tested and must not be described as primary-source verified."
    ],
    "jurisdictionType": "state"
  },
  {
    "country": "NZ",
    "identifierType": "tax_id_company",
    "identifierName": "IRD number",
    "validationLevel": "checksum",
    "authority": "New Zealand Inland Revenue",
    "sourceUrl": "https://www.ird.govt.nz/managing-my-tax/ird-numbers",
    "sourceType": "tax_authority",
    "accessedAt": "2026-06-15",
    "lastReviewedAt": "2026-06-15",
    "provenanceStatus": "corroborated",
    "limitations": [
      "Confirm entity applicability and archive the primary checksum specification.",
      "The 2026-06-15 provenance audit did not locate a public primary document containing the full algorithm; the rule remains cross-runtime tested and must not be described as primary-source verified."
    ],
    "jurisdictionType": "state"
  },
  {
    "country": "RS",
    "identifierType": "tax_id_company",
    "identifierName": "Poreski identifikacioni broj (PIB)",
    "validationLevel": "checksum",
    "authority": "Tax Administration of the Republic of Serbia",
    "sourceUrl": "https://www.purs.gov.rs/en.html",
    "sourceType": "tax_authority",
    "accessedAt": "2026-06-15",
    "lastReviewedAt": "2026-06-15",
    "provenanceStatus": "corroborated",
    "limitations": [
      "Archive the primary ISO 7064 rule and representative official example.",
      "The 2026-06-15 provenance audit did not locate a public primary document containing the full algorithm; the rule remains cross-runtime tested and must not be described as primary-source verified."
    ],
    "jurisdictionType": "state"
  },
  {
    "country": "TR",
    "identifierType": "tax_id_company",
    "identifierName": "Vergi Kimlik Numarasi (VKN)",
    "validationLevel": "checksum",
    "authority": "Gelir Idaresi Baskanligi",
    "sourceUrl": "https://www.gib.gov.tr/",
    "sourceType": "tax_authority",
    "accessedAt": "2026-06-15",
    "lastReviewedAt": "2026-06-15",
    "provenanceStatus": "corroborated",
    "limitations": [
      "Archive the primary VKN weighted checksum specification.",
      "The 2026-06-15 provenance audit did not locate a public primary document containing the full algorithm; the rule remains cross-runtime tested and must not be described as primary-source verified."
    ],
    "jurisdictionType": "state"
  },
  {
    "country": "US",
    "identifierType": "tax_id_company",
    "identifierName": "Employer Identification Number (EIN)",
    "validationLevel": "format",
    "authority": "Internal Revenue Service",
    "sourceUrl": "https://www.irs.gov/pub/irs-pdf/p1635.pdf",
    "sourceType": "tax_authority",
    "accessedAt": "2026-06-15",
    "lastReviewedAt": "2026-06-15",
    "provenanceStatus": "verified",
    "limitations": [
      "Offline validation checks only the documented nine-digit structure."
    ],
    "jurisdictionType": "state"
  },
  {
    "country": "AD",
    "jurisdictionType": "state",
    "identifierType": "tax_id_person",
    "identifierName": "Andorra - NRT (struttura)",
    "validationLevel": "format",
    "authority": "OECD Global Forum TIN documentation and recorded national authority",
    "sourceUrl": "https://www.oecd.org/en/networks/global-forum-tax-transparency/resources/aeoi-implementation-portal/tax-identification-numbers.html",
    "sourceType": "intergovernmental",
    "accessedAt": "2026-06-15",
    "lastReviewedAt": "2026-06-15",
    "provenanceStatus": "documented_limit",
    "limitations": [
      "Only the institutionally documented offline structure is claimed; no unpublished checksum or issuance status is inferred."
    ]
  },
  {
    "country": "AE",
    "jurisdictionType": "state",
    "identifierType": "tax_id_person",
    "identifierName": "Emirati Arabi Uniti - nessun TIN personale generalizzato",
    "validationLevel": "not_applicable",
    "authority": "OECD Global Forum TIN documentation and recorded national authority",
    "sourceUrl": "https://www.oecd.org/en/networks/global-forum-tax-transparency/resources/aeoi-implementation-portal/tax-identification-numbers.html",
    "sourceType": "intergovernmental",
    "accessedAt": "2026-06-15",
    "lastReviewedAt": "2026-06-15",